{
  "version": 2,
  "scopes": {
    "global": "all"
  },
  "aspects": {
    "process": "process"
  },
  "contexts": {},
  "rules": [
    {
      "id": "global.one",
      "scope": "global",
      "aspect": "process",
      "level": "should",
      "rule": "one rule",
      "why": "test",
      "check": {
        "type": "review",
        "how": "look"
      },
      "feedback": [],
      "history": [],
      "status": "active"
    },
    {
      "id": "global.no-todo",
      "scope": "global",
      "aspect": "process",
      "level": "must",
      "rule": "no TODO markers in src",
      "why": "test",
      "check": {
        "type": "auto",
        "how": "scan",
        "run": {
          "forbid": "TODO",
          "in": [
            "src/**"
          ]
        }
      },
      "feedback": [],
      "history": [],
      "status": "active"
    }
  ]
}
